name,id,cmc,type,subtype,text,power,toughness
Master of Waves,688,4,Creature,MerfolkWizard,"Protection from red Elemental creatures you control get +1/+1. When Master of Waves enters the battlefield, create a number of 1/0 blue Elemental creature tokens equal to your devotion to blue. (Each {U} in the mana costs of permanents you control counts toward your devotion to blue.)",2,1
Recuperate,689,4,Instant,None,Choose one — • You gain 6 life. • Prevent the next 6 damage that would be dealt to target creature this turn.,-999,-999
Avatar of Growth,690,6,Creature,ElementalAvatar,"This spell costs {1} less to cast for each opponent you have. Trample When Avatar of Growth enters the battlefield, each player searches their library for up to two basic land cards, puts them onto the battlefield, then shuffles their library.",4,4
Acquisitions Expert,691,2,Creature,HumanRogue,"When Acquisitions Expert enters the battlefield, target opponent reveals a number of cards from their hand equal to the number of creatures in your party. You choose one of those cards. That player discards that card. (Your party consists of up to one each of Cleric, Rogue, Warrior, and Wizard.)",1,2
Squirrel-Powered Scheme,692,3,Enchantment,None,Increase the result of each die you roll by 2.,-999,-999
Angel of Fury,693,6,Creature,Angel,"Flying When Angel of Fury dies, you may shuffle it into its owner's library.",3,5
Human Warrior,694,0,TokenCreature,HumanWarrior,"Trample, haste",3,1
Ill-Tempered Cyclops,695,4,Creature,Cyclops,"Trample {5}{R}: Monstrosity 3. (If this creature isn't monstrous, put three +1/+1 counters on it and it becomes monstrous.)",3,3
Torch Gauntlet,696,2,Artifact,Equipment,Equipped creature gets +2/+0. Equip {2} ({2}: Attach to target creature you control. Equip only as a sorcery.),-999,-999
Ghost of Ramirez DePietro,697,3,LegendaryCreature,PirateSpirit,"Ghost of Ramirez DePietro can't be blocked by creatures with toughness 3 or greater. Whenever Ghost of Ramirez DePietro deals combat damage to a player, choose up to one target card in a graveyard that was discarded or put there from a library this turn. Put that card into its owner's hand. Partner (You can have two commanders if both have partner.)",2,3
Desecrated Tomb,698,3,Artifact,None,"Whenever one or more creature cards leave your graveyard, create a 1/1 black Bat creature token with flying.",-999,-999
Viridian Lorebearers,699,4,Creature,ElfShaman,"{3}{G}, {T}: Target creature gets +X/+X until end of turn, where X is the number of artifacts your opponents control.",3,3
Mist-Syndicate Naga,700,3,Creature,NagaNinja,"Ninjutsu {2}{U} ({2}{U}, Return an unblocked attacker you control to hand: Put this card onto the battlefield from your hand tapped and attacking.) Whenever Mist-Syndicate Naga deals combat damage to a player, create a token that's a copy of Mist-Syndicate Naga.",3,1
Wall of Reverence,701,4,Creature,SpiritWall,"Defender, flying At the beginning of your end step, you may gain life equal to the power of target creature you control.",1,6
Subtle Strike,702,2,Instant,None,Choose one or both — • Target creature gets -1/-1 until end of turn. • Put a +1/+1 counter on target creature.,-999,-999
Aerial Toastmaster,703,4,ArtifactCreature,CyborgRigger,"Flying {3}{W}, Sacrifice another artifact: Aerial Toastmaster assembles a Contraption. (Put the top card of your Contraption deck face up onto one of your sprockets.)",3,2
Infiltrate,704,1,Instant,None,Target creature can't be blocked this turn.,-999,-999
Stenchskipper,705,4,Creature,Elemental,"Flying At the beginning of the end step, if you control no Goblins, sacrifice Stenchskipper.",6,5
Orochi Leafcaller,706,1,Creature,SnakeShaman,{G}: Add one mana of any color.,1,1
Goblin // Soldier,707,0,TokenCreature,Goblin//TokenCreature,None,-999,-999
Shower of Coals,708,5,Sorcery,None,Shower of Coals deals 2 damage to each of up to three targets. Threshold — Shower of Coals deals 4 damage to each of those permanents and/or players instead if seven or more cards are in your graveyard.,-999,-999
Muddle the Mixture,709,2,Instant,None,"Counter target instant or sorcery spell. Transmute {1}{U}{U} ({1}{U}{U}, Discard this card: Search your library for a card with the same converted mana cost as this card, reveal it, and put it into your hand. Then shuffle your library. Transmute only as a sorcery.)",-999,-999
Gideon's Company,710,4,Creature,HumanSoldier,"Whenever you gain life, put two +1/+1 counters on Gideon's Company. {3}{W}: Put a loyalty counter on target Gideon planeswalker.",3,3
Death Frenzy,711,5,Sorcery,None,"All creatures get -2/-2 until end of turn. Whenever a creature dies this turn, you gain 1 life.",-999,-999
Mana Geode,712,3,Artifact,None,"When Mana Geode enters the battlefield, scry 1. {T}: Add one mana of any color.",-999,-999
Treasure Mage,713,3,Creature,HumanWizard,"When Treasure Mage enters the battlefield, you may search your library for an artifact card with converted mana cost 6 or greater, reveal it, put it into your hand, then shuffle your library.",2,2
Blinkmoth Urn,714,5,Artifact,None,"At the beginning of each player's precombat main phase, if Blinkmoth Urn is untapped, that player adds {C} for each artifact they control.",-999,-999
Savage Firecat,715,5,Creature,ElementalCat,"Trample Savage Firecat enters the battlefield with seven +1/+1 counters on it. Whenever you tap a land for mana, remove a +1/+1 counter from Savage Firecat.",0,0
Renegade Doppelganger,716,2,Creature,Shapeshifter,"Whenever another creature enters the battlefield under your control, you may have Renegade Doppelganger become a copy of that creature until end of turn. (If it does, it loses this ability for the rest of the turn.)",0,1
Transcantation,717,2,Instant,None,Target instant or sorcery spell becomes a copy of Lightning Bolt. Its controller may choose new targets for it.,-999,-999
Assert Authority,718,7,Instant,None,"Affinity for artifacts (This spell costs {1} less to cast for each artifact you control.) Counter target spell. If that spell is countered this way, exile it instead of putting it into its owner's graveyard.",-999,-999
Labro Bot,719,5,ArtifactHostCreature,Dog,"When this creature enters the battlefield, return target host card or card with augment from your graveyard to your hand.",3,3
Blast from the Past,720,3,Instant,None,"Madness {R}, cycling {1}{R}, kicker {2}{R}, flashback {3}{R}, buyback {4}{R} Blast from the Past deals 2 damage to any target. If this spell was kicked, create a 1/1 red Goblin creature token.",-999,-999
Chain Reaction,721,4,Sorcery,None,"Chain Reaction deals X damage to each creature, where X is the number of creatures on the battlefield.",-999,-999
Assure // Assemble,722,8,Instant // Instant,None,None,-999,-999
Ephara's Radiance,723,1,Enchantment,Aura,"Enchant creature Enchanted creature has ""{1}{W}, {T}: You gain 3 life.""",-999,-999
Omen of the Sun,724,3,Enchantment,None,"Flash When Omen of the Sun enters the battlefield, create two 1/1 white Human Soldier creature tokens and you gain 2 life. {2}{W}, Sacrifice Omen of the Sun: Scry 2.",-999,-999
Scout the Borders,725,3,Sorcery,None,Reveal the top five cards of your library. You may put a creature or land card from among them into your hand. Put the rest into your graveyard.,-999,-999
Rest in Peace,726,2,Enchantment,None,"When Rest in Peace enters the battlefield, exile all cards from all graveyards. If a card or token would be put into a graveyard from anywhere, exile it instead.",-999,-999
Draconian Cylix,727,3,Artifact,None,"{2}, {T}, Discard a card at random: Regenerate target creature.",-999,-999
Chaoslace,728,1,Instant,None,Target spell or permanent becomes red. (Its mana symbols remain unchanged.),-999,-999
Nalathni Dragon,729,4,Creature,Dragon,"Flying; banding (Any creatures with banding, and up to one without, can attack in a band. Bands are blocked as a group. If any creatures with banding you control are blocking or being blocked by a creature, you divide that creature's combat damage, not its controller, among any of the creatures it's being blocked by or is blocking.) {R}: Nalathni Dragon gets +1/+0 until end of turn. If this ability has been activated four or more times this turn, sacrifice Nalathni Dragon at the beginning of the next end step.",1,1
Maul of the Skyclaves,730,3,Artifact,Equipment,"When Maul of the Skyclaves enters the battlefield, attach it to target creature you control. Equipped creature gets +2/+2 and has flying and first strike. Equip {2}{W}{W}",-999,-999
Shrieking Mogg,731,2,Creature,Goblin,"Haste When Shrieking Mogg enters the battlefield, tap all other creatures.",1,1
"Skullbriar, the Walking Grave",732,2,LegendaryCreature,ZombieElemental,"Haste Whenever Skullbriar, the Walking Grave deals combat damage to a player, put a +1/+1 counter on it. Counters remain on Skullbriar as it moves to any zone other than a player's hand or library.",1,1
Hammer Dropper,733,4,Creature,GiantSoldier,"Mentor (Whenever this creature attacks, put a +1/+1 counter on target attacking creature with lesser power.)",5,2
Incubator Drone,734,4,Creature,EldraziDrone,"Devoid (This card has no color.) When Incubator Drone enters the battlefield, create a 1/1 colorless Eldrazi Scion creature token. It has ""Sacrifice this creature: Add {C}.""",2,3
Counterbalance,735,2,Enchantment,None,"Whenever an opponent casts a spell, you may reveal the top card of your library. If you do, counter that spell if it has the same converted mana cost as the revealed card.",-999,-999
Spare Supplies,736,2,Artifact,None,"Spare Supplies enters the battlefield tapped. When Spare Supplies enters the battlefield, draw a card. {2}, {T}, Sacrifice Spare Supplies: Draw a card.",-999,-999
Sandstone Bridge,737,0,Land,None,"Sandstone Bridge enters the battlefield tapped. When Sandstone Bridge enters the battlefield, target creature gets +1/+1 and gains vigilance until end of turn. {T}: Add {W}.",-999,-999
Command Tower,738,0,Land,None,{T}: Add one mana of any color in your commander's color identity.,-999,-999
Aeolipile,739,2,Artifact,None,"{1}, {T}, Sacrifice Aeolipile: It deals 2 damage to any target.",-999,-999
Cascade Seer,740,4,Creature,MerfolkWizard,"When Cascade Seer enters the battlefield, scry X, where X is the number of creatures in your party. (Your party consists of up to one each of Cleric, Rogue, Warrior, and Wizard.)",3,3
Empty the Pits,741,4,Instant,None,Delve (Each card you exile from your graveyard while casting this spell pays for {1}.) Create X tapped 2/2 black Zombie creature tokens.,-999,-999
Soulfire Eruption,742,9,Sorcery,None,"Choose any number of target creatures, planeswalkers, and/or players. For each of them, exile the top card of your library, then Soulfire Eruption deals damage equal to that card's converted mana cost to that permanent or player. You may play the exiled cards until the end of your next turn.",-999,-999
Stensia Banquet,743,3,Sorcery,None,Stensia Banquet deals damage to target opponent or planeswalker equal to the number of Vampires you control. Draw a card.,-999,-999
Goblin Clearcutter,744,4,Creature,Goblin,"{T}, Sacrifice a Forest: Add three mana in any combination of {R} and/or {G}.",3,3
Neurok Transmuter,745,3,Creature,HumanWizard,"{U}: Target creature becomes an artifact in addition to its other types until end of turn. {U}: Until end of turn, target artifact creature becomes blue and isn't an artifact.",2,2
Thraben Foulbloods,746,3,Creature,ZombieDog,Delirium — Thraben Foulbloods gets +1/+1 and has menace as long as there are four or more card types among cards in your graveyard. (A creature with menace can't be blocked except by two or more creatures.),3,2
Marsh Gas,747,1,Instant,None,All creatures get -2/-0 until end of turn.,-999,-999
Trophy Mage,748,3,Creature,HumanWizard,"When Trophy Mage enters the battlefield, you may search your library for an artifact card with converted mana cost 3, reveal it, put it into your hand, then shuffle your library.",2,2
Extricator of Sin // Extricator of Flesh,749,3,Creature,HumanCleric//Creature,None,-999,-999
League Guildmage,750,2,Creature,HumanWizard,"{3}{U}, {T}: Draw a card. {X}{R}, {T}: Copy target instant or sorcery spell you control with converted mana cost X. You may choose new targets for the copy.",2,2
Epic Experiment,751,2,Sorcery,None,Exile the top X cards of your library. You may cast instant and sorcery spells with converted mana cost X or less from among them without paying their mana costs. Then put all cards exiled this way that weren't cast into your graveyard.,-999,-999
Windfall,752,3,Sorcery,None,"Each player discards their hand, then draws cards equal to the greatest number of cards a player discarded this way.",-999,-999
Junk Diver,753,3,ArtifactCreature,Bird,"Flying When Junk Diver dies, return another target artifact card from your graveyard to your hand.",1,1
Demolish,754,4,Sorcery,None,Destroy target artifact or land.,-999,-999
Talara's Battalion,755,2,Creature,ElfWarrior,Cast this spell only if you've cast another green spell this turn. Trample,4,3
Colossal Dreadmaw,756,6,Creature,Dinosaur,Trample (This creature can deal excess combat damage to the player or planeswalker it's attacking.),6,6
Zuran Orb,757,0,Artifact,None,Sacrifice a land: You gain 2 life.,-999,-999
Azorius First-Wing,758,2,Creature,Griffin,"Flying, protection from enchantments",2,2
Reya Dawnbringer,759,9,LegendaryCreature,Angel,"Flying At the beginning of your upkeep, you may return target creature card from your graveyard to the battlefield.",4,6
Ogre Jailbreaker,760,4,Creature,OgreRogue,Defender Ogre Jailbreaker can attack as though it didn't have defender as long as you control a Gate.,4,4
Outrage Shaman,761,5,Creature,GoblinShaman,"Chroma — When Outrage Shaman enters the battlefield, it deals damage to target creature equal to the number of red mana symbols in the mana costs of permanents you control.",2,2
"Illuna, Apex of Wishes",762,5,LegendaryCreature,BeastElementalDinosaur,"Mutate {3}{R/G}{U}{U} (If you cast this spell for its mutate cost, put it over or under target non-Human creature you own. They mutate into the creature on top plus all abilities from under it.) Flying, trample Whenever this creature mutates, exile cards from the top of your library until you exile a nonland permanent card. Put that card onto the battlefield or into your hand.",6,6
Psychic Rebuttal,763,2,Instant,None,"Counter target instant or sorcery spell that targets you. Spell mastery — If there are two or more instant and/or sorcery cards in your graveyard, you may copy the spell countered this way. You may choose new targets for the copy.",-999,-999
Chittering Rats,764,3,Creature,Rat,"When Chittering Rats enters the battlefield, target opponent puts a card from their hand on top of their library.",2,2
Cavalier of Gales,765,5,Creature,ElementalKnight,"Flying When Cavalier of Gales enters the battlefield, draw three cards, then put two cards from your hand on top of your library in any order. When Cavalier of Gales dies, shuffle it into its owner's library, then scry 2.",5,5
Brightstone Ritual,767,1,Instant,None,Add {R} for each Goblin on the battlefield.,-999,-999
Sturdy Hatchling,768,4,Creature,Elemental,"Sturdy Hatchling enters the battlefield with four -1/-1 counters on it. {G/U}: Sturdy Hatchling gains shroud until end of turn. (It can't be the target of spells or abilities.) Whenever you cast a green spell, remove a -1/-1 counter from Sturdy Hatchling. Whenever you cast a blue spell, remove a -1/-1 counter from Sturdy Hatchling.",6,6
Panacea,769,4,Artifact,None,"{X}{X}, {T}: Prevent the next X damage that would be dealt to any target this turn.",-999,-999
Dwell on the Past,770,1,Sorcery,None,Target player shuffles up to four target cards from their graveyard into their library.,-999,-999
Commander Greven il-Vec,771,6,LegendaryCreature,HumanWarrior,"Fear (This creature can't be blocked except by artifact creatures and/or black creatures.) When Commander Greven il-Vec enters the battlefield, sacrifice a creature.",7,5
Undead Slayer,772,3,Creature,HumanCleric,"{W}, {T}: Exile target Skeleton, Vampire, or Zombie.",2,2
Phyrexian Grimoire,773,3,Artifact,None,"{4}, {T}: Target opponent chooses one of the top two cards of your graveyard. Exile that card and put the other one into your hand.",-999,-999
Increasing Ambition,774,5,Sorcery,None,"Search your library for a card and put that card into your hand. If this spell was cast from a graveyard, instead search your library for two cards and put those cards into your hand. Then shuffle your library. Flashback {7}{B} (You may cast this card from your graveyard for its flashback cost. Then exile it.)",-999,-999
Blessing of the Nephilim,775,1,Enchantment,Aura,Enchant creature Enchanted creature gets +1/+1 for each of its colors.,-999,-999
Staggering Insight,776,2,Enchantment,Aura,"Enchant creature Enchanted creature gets +1/+1 and has lifelink and ""Whenever this creature deals combat damage to a player, draw a card.""",-999,-999
Rumbling Rockslide,777,4,Sorcery,None,Rumbling Rockslide deals damage to target creature equal to the number of lands you control.,-999,-999
Shining Armor,778,2,Artifact,Equipment,"Flash When Shining Armor enters the battlefield, attach it to target Knight you control. Equipped creature gets +0/+2 and has vigilance. Equip {3} ({3}: Attach to target creature you control. Equip only as a sorcery.)",-999,-999
Unholy Strength,779,1,Enchantment,Aura,Enchant creature Enchanted creature gets +2/+1.,-999,-999
Soldier,780,0,TokenCreature,Soldier,Defender,1,2
Tuinvale Treefolk // Oaken Boon,781,6,Creature,TreefolkDruid//Sorcery,None,6,5
"Silvar, Devourer of the Free",782,5,LegendaryCreature,CatNightmare,"Partner with Trynn, Champion of Freedom (When this creature enters the battlefield, target player may put Trynn into their hand from their library, then shuffle.) Menace Sacrifice a Human: Put a +1/+1 counter on Silvar, Devourer of the Free. It gains indestructible until end of turn.",4,2
Rathi Trapper,783,2,Creature,HumanRebelRogue,"{B}, {T}: Tap target creature.",1,2
Mogg Salvage,784,3,Instant,None,"If an opponent controls an Island and you control a Mountain, you may cast this spell without paying its mana cost. Destroy target artifact.",-999,-999
Prodigal Sorcerer Avatar,785,0,Vanguard,None,"At the beginning of your upkeep, look at the top card of your library. You may put that card into your graveyard.",-999,-999
Take Down,786,1,Sorcery,None,Choose one — • Take Down deals 4 damage to target creature with flying. • Take Down deals 1 damage to each creature with flying.,-999,-999
"Neheb, the Worthy",787,3,LegendaryCreature,MinotaurWarrior,"First strike Other Minotaurs you control have first strike. As long as you have one or fewer cards in hand, Minotaurs you control get +2/+0. Whenever Neheb, the Worthy deals combat damage to a player, each player discards a card.",2,2
Swift Warden,788,3,Creature,MerfolkWarrior,"Flash When Swift Warden enters the battlefield, target Merfolk you control gains hexproof until end of turn. (It can't be the target of spells or abilities your opponents control.)",3,3
Orcish Squatters Avatar,789,0,Vanguard,None,"At the beginning of your precombat main phase, add {C} for each land target opponent controls.",-999,-999
"Angrath, the Flame-Chained",790,5,LegendaryPlaneswalker,Angrath,+1: Each opponent discards a card and loses 2 life. −3: Gain control of target creature until end of turn. Untap it. It gains haste until end of turn. Sacrifice it at the beginning of the next end step if it has converted mana cost 3 or less. −8: Each opponent loses life equal to the number of cards in their graveyard.,-999,-999
Rune of Protection: Blue,791,2,Enchantment,None,"{W}: The next time a blue source of your choice would deal damage to you this turn, prevent that damage. Cycling {2} ({2}, Discard this card: Draw a card.)",-999,-999
Baleful Eidolon,793,2,EnchantmentCreature,Spirit,"Bestow {4}{B} (If you cast this card for its bestow cost, it's an Aura spell with enchant creature. It becomes a creature again if it's not attached to a creature.) Deathtouch (Any amount of damage this deals to a creature is enough to destroy it.) Enchanted creature gets +1/+1 and has deathtouch.",1,1
Deadly Grub,794,3,Creature,Insect,"Vanishing 3 (This creature enters the battlefield with three time counters on it. At the beginning of your upkeep, remove a time counter from it. When the last is removed, sacrifice it.) When Deadly Grub dies, if it had no time counters on it, create a 6/1 green Insect creature token with shroud. (It can't be the target of spells or abilities.)",3,1
Infectious Horror,795,4,Creature,ZombieHorror,"Whenever Infectious Horror attacks, each opponent loses 2 life.",2,2
Dwarven Miner,796,2,Creature,Dwarf,"{2}{R}, {T}: Destroy target nonbasic land.",1,2
Metallurgeon,797,2,ArtifactCreature,HumanArtificer,"{W}, {T}: Regenerate target artifact.",1,2
Verdant Haven,798,3,Enchantment,Aura,"Enchant land When Verdant Haven enters the battlefield, you gain 2 life. Whenever enchanted land is tapped for mana, its controller adds an additional one mana of any color.",-999,-999
Elephant Ambush,799,4,Instant,None,Create a 3/3 green Elephant creature token. Flashback {6}{G}{G} (You may cast this card from your graveyard for its flashback cost. Then exile it.),-999,-999
Robe of Mirrors,800,1,Enchantment,Aura,Enchant creature (Target a creature as you cast this. This card enters the battlefield attached to that creature.) Enchanted creature has shroud. (It can't be the target of spells or abilities.),-999,-999
Ghostfire Blade,801,1,Artifact,Equipment,Equipped creature gets +2/+2. Equip {3} Ghostfire Blade's equip ability costs {2} less to activate if it targets a colorless creature.,-999,-999
Metathran Aerostat,802,4,Creature,Metathran,"Flying {X}{U}: You may put a creature card with converted mana cost X from your hand onto the battlefield. If you do, return Metathran Aerostat to its owner's hand.",2,2
Rapacious Dragon,803,5,Creature,Dragon,"Flying When Rapacious Dragon enters the battlefield, create two Treasure tokens. (They're artifacts with ""{T}, Sacrifice this artifact: Add one mana of any color."")",3,3
Vault of Whispers,804,0,Artifact Land,None,(Vault of Whispers isn't a spell.) {T}: Add {B}.,-999,-999
Elvish Bard,805,5,Creature,ElfShaman,All creatures able to block Elvish Bard do so.,2,4
Nacatl Hunt-Pride,806,6,Creature,CatWarrior,"Vigilance {R}, {T}: Target creature can't block this turn. {G}, {T}: Target creature blocks this turn if able.",5,4
Ashnod,807,0,Vanguard,None,"Whenever a creature deals damage to you, destroy it.",-999,-999
Phantom Nantuko,808,3,Creature,InsectSpirit,"Trample Phantom Nantuko enters the battlefield with two +1/+1 counters on it. If damage would be dealt to Phantom Nantuko, prevent that damage. Remove a +1/+1 counter from Phantom Nantuko. {T}: Put a +1/+1 counter on Phantom Nantuko.",0,0
Kavu Primarch,809,4,Creature,Kavu,"Kicker {4} (You may pay an additional {4} as you cast this spell.) Convoke (Your creatures can help cast this spell. Each creature you tap while casting this spell pays for {1} or one mana of that creature's color.) If Kavu Primarch was kicked, it enters the battlefield with four +1/+1 counters on it.",3,3
"Melek, Izzet Paragon",810,6,LegendaryCreature,WeirdWizard,"Play with the top card of your library revealed. You may cast instant and sorcery spells from the top of your library. Whenever you cast an instant or sorcery spell from your library, copy it. You may choose new targets for the copy.",2,4
Pyroclast Consul,811,5,Creature,ElementalShaman,"Kinship — At the beginning of your upkeep, you may look at the top card of your library. If it shares a creature type with Pyroclast Consul, you may reveal it. If you do, Pyroclast Consul deals 2 damage to each creature.",3,3
Squee's Embrace,812,2,Enchantment,Aura,"Enchant creature Enchanted creature gets +2/+2. When enchanted creature dies, return that card to its owner's hand.",-999,-999
"Najeela, the Blade-Blossom",813,3,LegendaryCreature,HumanWarrior,"Whenever a Warrior attacks, you may have its controller create a 1/1 white Warrior creature token that's tapped and attacking. {W}{U}{B}{R}{G}: Untap all attacking creatures. They gain trample, lifelink, and haste until end of turn. After this phase, there is an additional combat phase. Activate this ability only during combat.",3,2
Krark-Clan Engineers,814,4,Creature,GoblinArtificer,"{R}, Sacrifice two artifacts: Destroy target artifact.",2,2
Orzhov Cluestone,815,3,Artifact,None,"{T}: Add {W} or {B}. {W}{B}, {T}, Sacrifice Orzhov Cluestone: Draw a card.",-999,-999
Mad Dog,816,2,Creature,Dog,"At the beginning of your end step, if Mad Dog didn't attack or come under your control this turn, sacrifice it.",2,2
Whirling Catapult,817,4,Artifact,None,"{2}, Exile the top two cards of your library: Whirling Catapult deals 1 damage to each creature with flying and each player.",-999,-999
Whipgrass Entangler,818,3,Creature,HumanCleric,"{1}{W}: Until end of turn, target creature gains ""This creature can't attack or block unless its controller pays {1} for each Cleric on the battlefield.""",1,3
Rusted Slasher,819,4,ArtifactCreature,Horror,Sacrifice an artifact: Regenerate Rusted Slasher.,4,1
Havoc Sower,820,4,Creature,EldraziDrone,Devoid (This card has no color.) {1}{C}: Havoc Sower gets +2/+1 until end of turn. ({C} represents colorless mana.),3,3
Flint Golem,821,4,ArtifactCreature,Golem,"Whenever Flint Golem becomes blocked, defending player mills three cards.",2,3
Deputized Protester,822,3,Creature,HumanWarrior,"Menace (This creature can't be blocked except by two or more creatures.) Melee (Whenever this creature attacks, it gets +1/+1 until end of turn for each opponent you attacked this combat.)",2,1
Magma Rift,824,3,Sorcery,None,"As an additional cost to cast this spell, sacrifice a land. Magma Rift deals 5 damage to target creature.",-999,-999
