name,id,cmc,type,subtype,text,power,toughness
Static Orb,0,3,Artifact,None,"As long as Static Orb is untapped, players can't untap more than two permanents during their untap steps.",-999,-999
Sensory Deprivation,1,1,Enchantment,Aura,Enchant creature Enchanted creature gets -3/-0.,-999,-999
Road of Return,2,2,Sorcery,None,Choose one — • Return target permanent card from your graveyard to your hand. • Put your commander into your hand from the command zone. Entwine {2} (Choose both if you pay the entwine cost.),-999,-999
Storm Crow,3,2,Creature,Bird,Flying (This creature can't be blocked except by creatures with flying or reach.),1,2
Walking Sponge,4,2,Creature,Sponge,"{T}: Target creature loses your choice of flying, first strike, or trample until end of turn.",1,1
Ravnica at War,5,4,Sorcery,None,Exile all multicolored permanents.,-999,-999
Torrent of Fire,6,5,Sorcery,None,Torrent of Fire deals damage to any target equal to the highest converted mana cost among permanents you control.,-999,-999
Wyluli Wolf,7,2,Creature,Wolf,{T}: Target creature gets +1/+1 until end of turn.,1,1
Pteramander,8,1,Creature,SalamanderDrake,"Flying {7}{U}: Adapt 4. This ability costs {1} less to activate for each instant and sorcery card in your graveyard. (If this creature has no +1/+1 counters on it, put four +1/+1 counters on it.)",1,1
Nantuko Elder,9,3,Creature,InsectDruid,{T}: Add {C}{G}.,1,2
Vedalken Heretic,10,2,Creature,VedalkenRogue,"Whenever Vedalken Heretic deals damage to an opponent, you may draw a card.",1,1
Waterknot,11,3,Enchantment,Aura,"Enchant creature When Waterknot enters the battlefield, tap enchanted creature. Enchanted creature doesn't untap during its controller's untap step.",-999,-999
Ruthless Knave,12,3,Creature,OrcPirate,"{2}{B}, Sacrifice a creature: Create two Treasure tokens. (They're artifacts with ""{T}, Sacrifice this artifact: Add one mana of any color."") Sacrifice three Treasures: Draw a card.",3,2
Palinchron,13,7,Creature,Illusion,"Flying When Palinchron enters the battlefield, untap up to seven lands. {2}{U}{U}: Return Palinchron to its owner's hand.",4,5
"Hua Tuo, Honored Physician",14,3,LegendaryCreature,Human,"{T}: Put target creature card from your graveyard on top of your library. Activate this ability only during your turn, before attackers are declared.",1,2
Veil of Summer,15,1,Instant,None,Draw a card if an opponent has cast a blue or black spell this turn. Spells you control can't be countered this turn. You and permanents you control gain hexproof from blue and from black until end of turn. (You and they can't be the targets of blue or black spells or abilities your opponents control.),-999,-999
Disposal Mummy,16,3,Creature,ZombieJackal,"When Disposal Mummy enters the battlefield, exile target card from an opponent's graveyard.",2,3
Wei Strike Force,17,3,Creature,HumanSoldier,Horsemanship (This creature can't be blocked except by creatures with horsemanship.),2,1
Marang River Prowler,18,3,Creature,HumanRogue,Marang River Prowler can't block and can't be blocked. You may cast Marang River Prowler from your graveyard as long as you control a black or green permanent.,2,1
Aura Graft,19,2,Instant,None,Gain control of target Aura that's attached to a permanent. Attach it to another permanent it can enchant.,-999,-999
Murk Dwellers,20,4,Creature,Zombie,"Whenever Murk Dwellers attacks and isn't blocked, it gets +2/+0 until end of combat.",2,2
Whispering Shade,21,4,Creature,Shade,Swampwalk (This creature can't be blocked as long as defending player controls a Swamp.) {B}: Whispering Shade gets +1/+1 until end of turn.,1,1
Wall of Fortune,22,2,ArtifactCreature,Wall,Defender You may tap an untapped Wall you control to have any player reroll a die that player rolled.,0,4
Saheeli's Artistry,23,6,Sorcery,None,"Choose one or both — • Create a token that's a copy of target artifact. • Create a token that's a copy of target creature, except it's an artifact in addition to its other types.",-999,-999
"Kalitas, Bloodchief of Ghet",24,7,LegendaryCreature,VampireWarrior,"{B}{B}{B}, {T}: Destroy target creature. If that creature dies this way, create a black Vampire creature token. Its power is equal to that creature's power and its toughness is equal to that creature's toughness.",5,5
Safewright Quest,25,1,Sorcery,None,"Search your library for a Forest or Plains card, reveal it, and put it into your hand. Then shuffle your library.",-999,-999
Instill Infection,26,4,Instant,None,Put a -1/-1 counter on target creature. Draw a card.,-999,-999
Weakstone,27,4,Artifact,None,Attacking creatures get -1/-0.,-999,-999
Demon,28,0,TokenCreature,Demon,Flying,5,5
Strength of Night,29,3,Instant,None,"Kicker {B} (You may pay an additional {B} as you cast this spell.) Creatures you control get +1/+1 until end of turn. If this spell was kicked, Zombie creatures you control get an additional +2/+2 until end of turn.",-999,-999
"Spike, Tournament Grinder",30,4,LegendaryCreature,HumanGamer,({B/P} can be paid with either {B} or 2 life.) {B/P}{B/P}{B/P}{B/P}: Reveal a card you own from outside the game that has been banned or restricted in a Constructed format and put it into your hand.,1,1
Keldon Raider,31,4,Creature,HumanWarrior,"When Keldon Raider enters the battlefield, you may discard a card. If you do, draw a card.",4,3
Behemoth Sledge,33,3,Artifact,Equipment,Equipped creature gets +2/+2 and has trample and lifelink. Equip {3},-999,-999
Kindred Discovery,34,5,Enchantment,None,"As Kindred Discovery enters the battlefield, choose a creature type. Whenever a creature you control of the chosen type enters the battlefield or attacks, draw a card.",-999,-999
Stern Marshal,35,3,Creature,HumanSoldier,"{T}: Target creature gets +2/+2 until end of turn. Activate this ability only during your turn, before attackers are declared.",2,2
Trapjaw Tyrant,36,5,Creature,Dinosaur,"Enrage — Whenever Trapjaw Tyrant is dealt damage, exile target creature an opponent controls until Trapjaw Tyrant leaves the battlefield.",5,5
Strength of Unity,37,4,Enchantment,Aura,Enchant creature Domain — Enchanted creature gets +1/+1 for each basic land type among lands you control.,-999,-999
Savai Triome,38,0,Land,MountainPlainsSwamp,"({T}: Add {R}, {W}, or {B}.) Savai Triome enters the battlefield tapped. Cycling {3} ({3}, Discard this card: Draw a card.)",-999,-999
Forest 2 // Forest 2,39,0,Card // Card,None,None,-999,-999
Warden of the First Tree,40,1,Creature,Human,"{1}{W/B}: Warden of the First Tree becomes a Human Warrior with base power and toughness 3/3. {2}{W/B}{W/B}: If Warden of the First Tree is a Warrior, it becomes a Human Spirit Warrior with trample and lifelink. {3}{W/B}{W/B}{W/B}: If Warden of the First Tree is a Spirit, put five +1/+1 counters on it.",1,1
Thunderherd Migration,41,2,Sorcery,None,"As an additional cost to cast this spell, reveal a Dinosaur card from your hand or pay {1}. Search your library for a basic land card, put it onto the battlefield tapped, then shuffle your library.",-999,-999
Carnage Wurm,42,7,Creature,Wurm,"Bloodthirst 3 (If an opponent was dealt damage this turn, this creature enters the battlefield with three +1/+1 counters on it.) Trample (This creature can deal excess combat damage to the player or planeswalker it's attacking.)",6,6
Goblin Barrage,43,4,Sorcery,None,"Kicker—Sacrifice an artifact or Goblin. (You may sacrifice an artifact or Goblin in addition to any other costs as you cast this spell.) Goblin Barrage deals 4 damage to target creature. If this spell was kicked, it also deals 4 damage to target player or planeswalker.",-999,-999
Pharika's Mender,44,5,Creature,Gorgon,"When Pharika's Mender enters the battlefield, you may return target creature or enchantment card from your graveyard to your hand.",4,3
Mind Extraction,45,3,Sorcery,None,"As an additional cost to cast this spell, sacrifice a creature. Target player reveals their hand and discards all cards of each of the sacrificed creature's colors.",-999,-999
Thopter Assembly,46,6,ArtifactCreature,Thopter,"Flying At the beginning of your upkeep, if you control no Thopters other than Thopter Assembly, return Thopter Assembly to its owner's hand and create five 1/1 colorless Thopter artifact creature tokens with flying.",5,5
Theft of Dreams,47,3,Sorcery,None,Draw a card for each tapped creature target opponent controls.,-999,-999
Brawn,49,4,Creature,Incarnation,"Trample As long as Brawn is in your graveyard and you control a Forest, creatures you control have trample.",3,3
Steadfast Cathar,50,2,Creature,HumanSoldier,"Whenever Steadfast Cathar attacks, it gets +0/+2 until end of turn.",2,1
Magma Sliver,51,4,Creature,Sliver,"All Slivers have ""{T}: Target Sliver creature gets +X/+0 until end of turn, where X is the number of Slivers on the battlefield.""",3,3
Deem Worthy,52,5,Instant,None,"Deem Worthy deals 7 damage to target creature. Cycling {3}{R} ({3}{R}, Discard this card: Draw a card.) When you cycle Deem Worthy, you may have it deal 2 damage to target creature.",-999,-999
Coalition Relic,53,3,Artifact,None,"{T}: Add one mana of any color. {T}: Put a charge counter on Coalition Relic. At the beginning of your precombat main phase, remove all charge counters from Coalition Relic. Add one mana of any color for each charge counter removed this way.",-999,-999
Vizier of Deferment,54,3,Creature,HumanCleric,"Flash When Vizier of Deferment enters the battlefield, you may exile target creature if it attacked or blocked this turn. Return that card to the battlefield under its owner's control at the beginning of the next end step.",2,2
"Tinybones, Trinket Thief",55,2,LegendaryCreature,SkeletonRogue,"At the beginning of each end step, if an opponent discarded a card this turn, you draw a card and you lose 1 life. {4}{B}{B}: Each opponent with no cards in hand loses 10 life.",1,2
"Shizo, Death's Storehouse",56,0,Legendary Land,None,"{T}: Add {B}. {B}, {T}: Target legendary creature gains fear until end of turn. (It can't be blocked except by artifact creatures and/or black creatures.)",-999,-999
Summon the School,57,4,TribalSorcery,Merfolk,Create two 1/1 blue Merfolk Wizard creature tokens. Tap four untapped Merfolk you control: Return Summon the School from your graveyard to your hand.,-999,-999
Courageous Outrider,58,4,Creature,HumanScout,"When Courageous Outrider enters the battlefield, look at the top four cards of your library. You may reveal a Human card from among them and put it into your hand. Put the rest on the bottom of your library in any order.",3,4
Soul-Scar Mage,59,1,Creature,HumanWizard,"Prowess If a source you control would deal noncombat damage to a creature an opponent controls, put that many -1/-1 counters on that creature instead.",1,2
Airdrop Aeronauts,60,5,Creature,DwarfScout,"Flying Revolt — When Airdrop Aeronauts enters the battlefield, if a permanent you controlled left the battlefield this turn, you gain 5 life.",4,3
Phyrexian Juggernaut,62,6,ArtifactCreature,Juggernaut,Infect (This creature deals damage to creatures in the form of -1/-1 counters and to players in the form of poison counters.) Phyrexian Juggernaut attacks each combat if able.,5,5
"Yorvo, Lord of Garenbrig",63,3,LegendaryCreature,GiantNoble,"Yorvo, Lord of Garenbrig enters the battlefield with four +1/+1 counters on it. Whenever another green creature enters the battlefield under your control, put a +1/+1 counter on Yorvo. Then if that creature's power is greater than Yorvo's power, put another +1/+1 counter on Yorvo.",0,0
Squadron Hawk,64,2,Creature,Bird,"Flying When Squadron Hawk enters the battlefield, you may search your library for up to three cards named Squadron Hawk, reveal them, put them into your hand, then shuffle your library.",1,1
Boros Recruit,65,1,Creature,GoblinSoldier,({R/W} can be paid with either {R} or {W}.) First strike,1,1
Patchwork Gnomes,66,3,ArtifactCreature,Gnome,Discard a card: Regenerate Patchwork Gnomes.,2,1
Ogre Arsonist,67,5,Creature,Ogre,"When Ogre Arsonist enters the battlefield, destroy target land.",3,3
Hunt the Hunter,68,1,Sorcery,None,Target green creature you control gets +2/+2 until end of turn. It fights target green creature an opponent controls.,-999,-999
Timber Gorge,69,0,Land,None,Timber Gorge enters the battlefield tapped. {T}: Add {R} or {G}.,-999,-999
Crypt Creeper,70,2,Creature,Zombie,Sacrifice Crypt Creeper: Exile target card from a graveyard.,2,1
Unyielding Krumar,71,4,Creature,OrcWarrior,{1}{W}: Unyielding Krumar gains first strike until end of turn.,3,3
Solemn Simulacrum,72,4,ArtifactCreature,Golem,"When Solemn Simulacrum enters the battlefield, you may search your library for a basic land card, put that card onto the battlefield tapped, then shuffle your library. When Solemn Simulacrum dies, you may draw a card.",2,2
Demonic Vigor,73,1,Enchantment,Aura,"Enchant creature Enchanted creature gets +1/+1. When enchanted creature dies, return that card to its owner's hand.",-999,-999
Guul Draz Vampire,74,1,Creature,VampireRogue,"As long as an opponent has 10 or less life, Guul Draz Vampire gets +2/+1 and has intimidate. (It can't be blocked except by artifact creatures and/or creatures that share a color with it.)",1,1
Utopia Sprawl,75,1,Enchantment,Aura,"Enchant Forest As Utopia Sprawl enters the battlefield, choose a color. Whenever enchanted Forest is tapped for mana, its controller adds an additional one mana of the chosen color.",-999,-999
Game Trail,76,0,Land,None,"As Game Trail enters the battlefield, you may reveal a Mountain or Forest card from your hand. If you don't, Game Trail enters the battlefield tapped. {T}: Add {R} or {G}.",-999,-999
Puppeteer Clique,77,5,Creature,FaerieWizard,"Flying When Puppeteer Clique enters the battlefield, put target creature card from an opponent's graveyard onto the battlefield under your control. It gains haste. At the beginning of your next end step, exile it. Persist (When this creature dies, if it had no -1/-1 counters on it, return it to the battlefield under its owner's control with a -1/-1 counter on it.)",3,2
Talisman of Progress,78,2,Artifact,None,{T}: Add {C}. {T}: Add {W} or {U}. Talisman of Progress deals 1 damage to you.,-999,-999
Harvest Pyre,79,2,Instant,None,"As an additional cost to cast this spell, exile X cards from your graveyard. Harvest Pyre deals X damage to target creature.",-999,-999
Krovikan Sorcerer,80,3,Creature,HumanWizard,"{T}, Discard a nonblack card: Draw a card. {T}, Discard a black card: Draw two cards, then discard one of them.",1,1
Bond of Discipline,81,5,Sorcery,None,Tap all creatures your opponents control. Creatures you control gain lifelink until end of turn.,-999,-999
Tanglewalker,82,3,Creature,Dryad,Each creature you control can't be blocked as long as defending player controls an artifact land.,2,2
Selesnya Sanctuary,83,0,Land,None,"Selesnya Sanctuary enters the battlefield tapped. When Selesnya Sanctuary enters the battlefield, return a land you control to its owner's hand. {T}: Add {G}{W}.",-999,-999
Dakmor Lancer,84,6,Creature,HumanKnight,"When Dakmor Lancer enters the battlefield, destroy target nonblack creature.",3,3
Bladed Sentinel,85,4,ArtifactCreature,Construct,{W}: Bladed Sentinel gains vigilance until end of turn.,2,4
Collective Voyage,86,1,Sorcery,None,"Join forces — Starting with you, each player may pay any amount of mana. Each player searches their library for up to X basic land cards, where X is the total amount of mana paid this way, puts them onto the battlefield tapped, then shuffles their library.",-999,-999
Shadowcloak Vampire,87,5,Creature,Vampire,Pay 2 life: Shadowcloak Vampire gains flying until end of turn. (It can't be blocked except by creatures with flying or reach.),4,3
Waste Not,88,2,Enchantment,None,"Whenever an opponent discards a creature card, create a 2/2 black Zombie creature token. Whenever an opponent discards a land card, add {B}{B}. Whenever an opponent discards a noncreature, nonland card, draw a card.",-999,-999
Spell Contortion,89,3,Instant,None,Multikicker {1}{U} (You may pay an additional {1}{U} any number of times as you cast this spell.) Counter target spell unless its controller pays {2}. Draw a card for each time Spell Contortion was kicked.,-999,-999
Refocus,90,2,Instant,None,Untap target creature. Draw a card.,-999,-999
Darkling Stalker,91,4,Creature,ShadeSpirit,{B}: Regenerate Darkling Stalker. {B}: Darkling Stalker gets +1/+1 until end of turn.,1,1
Duplicity,92,5,Enchantment,None,"When Duplicity enters the battlefield, exile the top five cards of your library face down. At the beginning of your upkeep, you may exile all cards from your hand face down. If you do, put all other cards you own exiled with Duplicity into your hand. At the beginning of your end step, discard a card. When you lose control of Duplicity, put all cards exiled with Duplicity into their owner's graveyard.",-999,-999
Planebound Accomplice,93,3,Creature,HumanWizard,{R}: You may put a planeswalker card from your hand onto the battlefield. Sacrifice it at the beginning of the next end step.,1,3
Ondu Rising,94,2,Sorcery,None,"Whenever a creature attacks this turn, it gains lifelink until end of turn. Awaken 4—{4}{W} (If you cast this spell for {4}{W}, also put four +1/+1 counters on target land you control and it becomes a 0/0 Elemental creature with haste. It's still a land.)",-999,-999
Welkin Tern,95,2,Creature,Bird,Flying (This creature can't be blocked except by creatures with flying or reach.) Welkin Tern can block only creatures with flying.,2,1
Chamber of Manipulation,96,4,Enchantment,Aura,"Enchant land Enchanted land has ""{T}, Discard a card: Gain control of target creature until end of turn.""",-999,-999
Sanguine Indulgence,97,4,Sorcery,None,This spell costs {3} less to cast if you've gained 3 or more life this turn. Return up to two target creature cards from your graveyard to your hand.,-999,-999
Shrewd Hatchling,98,4,Creature,Elemental,"Shrewd Hatchling enters the battlefield with four -1/-1 counters on it. {U/R}: Target creature can't block Shrewd Hatchling this turn. Whenever you cast a blue spell, remove a -1/-1 counter from Shrewd Hatchling. Whenever you cast a red spell, remove a -1/-1 counter from Shrewd Hatchling.",6,6
Etchings of the Chosen,99,3,Enchantment,None,"As Etchings of the Chosen enters the battlefield, choose a creature type. Creatures you control of the chosen type get +1/+1. {1}, Sacrifice a creature of the chosen type: Target creature you control gains indestructible until end of turn.",-999,-999
"Higure, the Still Wind",100,5,LegendaryCreature,HumanNinja,"Ninjutsu {2}{U}{U} ({2}{U}{U}, Return an unblocked attacker you control to hand: Put this card onto the battlefield from your hand tapped and attacking.) Whenever Higure, the Still Wind deals combat damage to a player, you may search your library for a Ninja card, reveal it, and put it into your hand. If you do, shuffle your library. {2}: Target Ninja creature can't be blocked this turn.",3,4
Heartwarming Redemption,101,4,Instant,None,"Discard all the cards in your hand, then draw that many cards plus one. You gain life equal to the number of cards in your hand.",-999,-999
Soul of the Rapids,102,5,Creature,Elemental,Flying Hexproof (This creature can't be the target of spells or abilities your opponents control.),3,2
Arc Mage,103,3,Creature,HumanSpellshaper,"{2}{R}, {T}, Discard a card: Arc Mage deals 2 damage divided as you choose among one or two targets.",2,2
Fracturing Gust,104,5,Instant,None,Destroy all artifacts and enchantments. You gain 2 life for each permanent destroyed this way.,-999,-999
Divergent Growth,105,1,Instant,None,"Until end of turn, lands you control gain ""{T}: Add one mana of any color.""",-999,-999
Minion Reflector,106,5,Artifact,None,"Whenever a nontoken creature enters the battlefield under your control, you may pay {2}. If you do, create a token that's a copy of that creature, except it has haste and ""At the beginning of the end step, sacrifice this permanent.""",-999,-999
Dirtwater Wraith,107,4,Creature,Wraith,Swampwalk (This creature can't be blocked as long as defending player controls a Swamp.) {B}: Dirtwater Wraith gets +1/+0 until end of turn.,1,3
Cruel Ultimatum,108,7,Sorcery,None,"Target opponent sacrifices a creature, discards three cards, then loses 5 life. You return a creature card from your graveyard to your hand, draw three cards, then gain 5 life.",-999,-999
Puresight Merrow,109,2,Creature,MerfolkWizard,"{W/U}, {Q}: Look at the top card of your library. You may exile that card. ({Q} is the untap symbol.)",2,2
Dragon Fangs,110,2,Enchantment,Aura,"Enchant creature Enchanted creature gets +1/+1 and has trample. When a creature with converted mana cost 6 or greater enters the battlefield, you may return Dragon Fangs from your graveyard to the battlefield attached to that creature.",-999,-999
Heal,111,1,Instant,None,Prevent the next 1 damage that would be dealt to any target this turn. Draw a card at the beginning of the next turn's upkeep.,-999,-999
Maraleaf Pixie,112,2,Creature,Faerie,Flying {T}: Add {G} or {U}.,2,2
Bull Rush,113,1,Instant,None,Target creature gets +2/+0 until end of turn.,-999,-999
Akroan Line Breaker,114,3,Creature,HumanWarrior,"Heroic — Whenever you cast a spell that targets Akroan Line Breaker, Akroan Line Breaker gets +2/+0 and gains intimidate until end of turn. (It can't be blocked except by artifact creatures and/or creatures that share a color with it.)",2,1
Grip of Amnesia,115,2,Instant,None,Counter target spell unless its controller exiles all cards from their graveyard. Draw a card.,-999,-999
Deny the Divine,116,3,Instant,None,"Counter target creature or enchantment spell. If that spell is countered this way, exile it instead of putting it into its owner's graveyard.",-999,-999
Pheres-Band Brawler,117,6,Creature,CentaurWarrior,"When Pheres-Band Brawler enters the battlefield, it fights up to one target creature you don't control. (Each deals damage equal to its power to the other.)",4,4
Sunbeam Spellbomb,118,1,Artifact,None,"{W}, Sacrifice Sunbeam Spellbomb: You gain 5 life. {1}, Sacrifice Sunbeam Spellbomb: Draw a card.",-999,-999
Goblin Flotilla,119,3,Creature,Goblin,"Islandwalk (This creature can't be blocked as long as defending player controls an Island.) At the beginning of each combat, unless you pay {R}, whenever Goblin Flotilla blocks or becomes blocked by a creature this combat, that creature gains first strike until end of turn.",2,2
Inquisitive Puppet,121,1,ArtifactCreature,Construct,"When Inquisitive Puppet enters the battlefield, scry 1. Exile Inquisitive Puppet: Create a 1/1 white Human creature token.",0,2
Aven Squire,122,2,Creature,BirdSoldier,"Flying Exalted (Whenever a creature you control attacks alone, that creature gets +1/+1 until end of turn.)",1,1
Doubling Season,123,5,Enchantment,None,"If an effect would create one or more tokens under your control, it creates twice that many of those tokens instead. If an effect would put one or more counters on a permanent you control, it puts twice that many of those counters on that permanent instead.",-999,-999
Stone Kavu,124,5,Creature,Kavu,{R}: Stone Kavu gets +1/+0 until end of turn. {W}: Stone Kavu gets +0/+1 until end of turn.,3,3
Brawl-Bash Ogre,125,4,Creature,OgreWarrior,"Menace (This creature can't be blocked except by two or more creatures.) Whenever Brawl-Bash Ogre attacks, you may sacrifice another creature. If you do, Brawl-Bash Ogre gets +2/+2 until end of turn.",3,3
Divine Intervention,126,8,Enchantment,None,"Divine Intervention enters the battlefield with two intervention counters on it. At the beginning of your upkeep, remove an intervention counter from Divine Intervention. When you remove the last intervention counter from Divine Intervention, the game is a draw.",-999,-999
Reckless Cohort,127,2,Creature,HumanWarriorAlly,Reckless Cohort attacks each combat if able unless you control another Ally.,2,2
Dragon Egg,128,0,TokenCreature,DragonEgg,"Defender When this creature dies, create a 2/2 red Dragon creature token with flying and ""{R}: This creature gets +1/+0 until end of turn.""",0,2
Arcbond,130,3,Instant,None,"Choose target creature. Whenever that creature is dealt damage this turn, it deals that much damage to each other creature and each player.",-999,-999
Summit Apes,131,4,Creature,Ape,"As long as you control a Mountain, Summit Apes has menace. (It can't be blocked except by two or more creatures.)",5,2
Box of Free-Range Goblins,132,6,Sorcery,None,Roll a six-sided die. Create a number of 1/1 red Goblin creature tokens equal to the result.,-999,-999
Zulaport Chainmage,133,4,Creature,HumanShamanAlly,"Cohort — {T}, Tap an untapped Ally you control: Target opponent loses 2 life.",4,2
Zodiac Goat,134,1,Creature,Goat,Mountainwalk (This creature can't be blocked as long as defending player controls a Mountain.),1,1
Cinder Elemental,135,4,Creature,Elemental,"{X}{R}, {T}, Sacrifice Cinder Elemental: It deals X damage to any target.",2,2
Cabal Therapy,136,1,Sorcery,None,Choose a nonland card name. Target player reveals their hand and discards all cards with that name. Flashback—Sacrifice a creature. (You may cast this card from your graveyard for its flashback cost. Then exile it.),-999,-999
Urborg Volcano,137,0,Land,None,Urborg Volcano enters the battlefield tapped. {T}: Add {B} or {R}.,-999,-999
Throttle,138,5,Instant,None,Target creature gets -4/-4 until end of turn.,-999,-999
Vampire Hounds,139,3,Creature,VampireDog,Discard a creature card: Vampire Hounds gets +2/+2 until end of turn.,2,2
Patient Turtle,140,4,Creature,Turtle,Patient Turtle enters the battlefield with two +1/+1 counters on it if you didn't go first this game.,3,3
Mindclaw Shaman,141,5,Creature,ViashinoShaman,"When Mindclaw Shaman enters the battlefield, target opponent reveals their hand. You may cast an instant or sorcery spell from among those cards without paying its mana cost.",2,2
